Title,Author,Publication Year
Soziologie unter Anwesenden : Systemtheoretische Vorlesungen 1966-1970 / Niklas Luhmann,"Luhmann, Niklas [Verfasser]; Gesigora, Christoph [Herausgeber]; Kieserling, André [Herausgeber]; Schmidt, Johannes F. K. [Herausgeber]",2024
Erkenntnis als Konstruktion : (Great Papers Soziologie) / Niklas Luhmann,"Luhmann, Niklas [Verfasser]; Jahraus, Oliver [Herausgeber]",2023
Schriften zur Organisation 6 : Annotationen und Verzeichnisse / Niklas Luhmann,"Luhmann, Niklas; Tacke, Veronika",2023
"""Wie interessant"" - den Wahnsinn der Organisation verstehen / mit Niklas Luhmann ; Zeichnungen: Michael Hüther","Luhmann, Niklas [Sonstige]; Hüter, Michael [Illustrator]; Wallraf-Pflug, Daniela Verfasser]; Groth, Torsten [Verfasser]; Günther, Stefan [Verfasser]; Ohler, Matthias [Verfasser]; [Simon, Fritz B. [Verfasser]",2023
"[Grundrechte als Institution] ; Droits de l'homme et différenciation sociale : une contribution à la sociologie politique / Niklas Luhmann ; traduction, présentation et bibliographie par Lukas K. Sosoe","Luhmann, Niklas [Verfasser]",2022
Luhmann leicht gemacht : Eine Einführung in die Systemtheorie / Margot Berghaus,"Berghaus, Margot [Verfasser]",2022
Luhmann leicht gemacht : eine Einführung in die Systemtheorie / Margot Berghaus,"Berghaus, Margot [Verfasser]",2022
Schriften zur Organisation 5 : Vorträge • Lexikonartikel • Rezensionen,"Luhmann, Niklas [Verfasser]; Tacke, Veronika [Herausgeber]",2022
"The making of meaning : from the individual to social order, selections from Niklas Luhmann's works on semantics and social structure / edited by Christian Morgner ; translated by Margaret Hiley, Christian Morgner, and Michael King","Luhmann, Niklas,, 1927-1998; Morgner, Christian [editor]",2022
Vorträge - Lexikonartikel - Rezensionen / Niklas Luhmann ; herausgegeben von Ernst Lukas und Veronika Tacke,"Luhmann, Niklas [Verfasser]; Lukas, Ernst [Herausgeber]; Tacke, Veronika [Herausgeber]",2022
"(Wie) Funktioniert unsere Gesellschaft, Herr Luhmann? : ein fiktives, aber reales Interview mit dem Soziologen Niklas Luhmann / Mathias Günther","Günther, Mathias Verfasser]; [Luhmann, Niklas [Sonstige]",2022-2022
[Luhmann] ; Comunicazione ecologica : Può la società moderna affrontare le minacce ecologiche? / Niklas Luhmann a cura di Alberto Cevolini,"Luhmann, Niklas [Verfasser]",2021
Die Grenzen der Verwaltung / Niklas Luhmann ; herausgegeben von Johannes F.K. Schmidt und Christoph Gesigora ; mit einem Nachwort von André Kieserling und Johannes F.K. Schmidt,"Luhmann, Niklas [Verfasser]",2021
Die Grenzen der Verwaltung / Niklas Luhmann,"Luhmann, Niklas [Verfasser]; Schmidt, Johannes F. K. [Herausgeber]; Gesigora, Christoph [Herausgeber]",2021
Differenz - Kopplung - Reflexion : Beiträge zur Gesellschaftstheorie / Niklas Luhmann ; hrsgg. von Johannes F.K. Schmidt und André Kieserling,"Luhmann, Niklas [Verfasser]; Schmidt, Johannes F. K. [Herausgeber]",2021
[Luhmann] ; La société de la société / Niklas Luhmann ; traduit de l'allemand par Flavien Le Bouterllschaft der Gesellschaft <franz.>,"Luhmann, Niklas [Verfasser]; Le Bouter, Flavien [Übersetzer]",2021
"Lektüre als Form : Das absolute Buch bei Friedrich Schlegel, Walter Benjamin und Niklas Luhmann / Charlotte Coch","Coch, Charlotte [Verfasser]",2021
"Lektüre als Form : das absolute Buch bei Friedrich Schlegel, Walter Benjamin und Niklas Luhmann / Charlotte Coch","Coch, Charlotte [Verfasser]",2021
"Niklas Luhmann am OVG Lüneburg : zur Entstehung der Systemtheorie / herausgegeben von Timon Beyes, Wolfgang Hagen, Claus Pias und Martin Warnke","Warnke, Martin [Herausgeber]; Beyes, Timon [Herausgeber]; Pias, Claus [Herausgeber]; Hagen, Wolfgang [Herausgeber]",2021
Niklas Luhmann am OVG Lüneburg. : Zur Entstehung der Systemtheorie.,"Warnke, Martin [Herausgeber]; Beyes, Timon [Herausgeber]; Hagen, Wolfgang [Herausgeber]; Pias, Claus [Herausgeber]",2021
[Luhmann] ; Právo společnosti / Niklas Luhmann ; z německého originálu přeložil Milan Váňa,"Luhmann, Niklas [Verfasser]; Váňa, Milan. [Übersetzer]",2021
"[Soziale Systeme] ; Soziale Systeme : Grundriß einer allgemeinen Theorie, chinesisch","Luhmann, Niklas [Sonstige]",2021
"Systemtheorie, Diskurstheorie und das Recht der Transzendentalphilosophie : Kant - Luhmann - Habermas / Miguel Torres Morales","Torres Morales, Miguel [Verfasser]",2021
"Technologisches Regieren : der Aufstieg des Netzwerk-Denkens in der Krise der Moderne :  Foucault, Luhmann und die Kybernetik / Vincent August","August, Vincent [Verfasser]",2021
"Technologisches Regieren : Der Aufstieg des Netzwerk-Denkens in der Krise der Moderne. Foucault, Luhmann und die Kybernetik / Vincent August","August, Vincent [Verfasser]",2021
Peatükid 1/3,,2021
Peatükid 4/5,,2021
[Luhmann] ; Ühiskonna ühiskond / Niklas Luhmann ; saksa keelest tõlkinud Piret Metspalu,"Luhmann, Niklas [Verfasser]",2021-2021
"Unlocking Luhmann : A Keyword Introduction to Systems Theory / Claudio Baraldi, Giancarlo Corsi, Elena Esposito","Baraldi, Claudio [Verfasser]; Corsi, Giancarlo [Verfasser]; Esposito, Elena [Verfasser]; Walker, Katherine U. [Übersetzer]",2021
"Unlocking Luhmann : a keyword introduction to systems theory / Claudio Baraldi, Giancarlo Corsi, Elena Esposito ; translation by Katherine Walker","Baraldi, Claudio [Verfasser]; Corsi, Giancarlo [Verfasser]; Esposito, Elena [Verfasser]",2021
[Luhmann] ; Yení Şef : bürokratik tutuculuk ve liderlik / Niklas Luhmann ; Türkçesi Mustafa Şahin Garipbaş,"Luhmann, Niklas [Verfasser]",2021
Die Spur der Gesellschaft : Reflexionen zur Gesellschaftstheorie nach Luhmann / Tobias Arenz,"Arenz, Tobias [Verfasser]",2020
Ein Luhmann-Leitfaden für Ökonomen : eine Neugründung der Ordnungstheorie / Bruno Schönfelder,"Schönfelder, Bruno [Verfasser]",2020
Ein Luhmann-Leitfaden für Ökonomen : Eine Neugründung der Ordnungstheorie / Bruno Schönfelder,"Schönfelder, Bruno [Verfasser]",2020
Einführung in die Systemtheorie / Niklas Luhmann,"Luhmann, Niklas [Verfasser]; Baecker, Dirk [Herausgeber]",2020
"História, semântica e sociedade / Niklas Luhmann ; editado por Leopoldo Waizbort","Luhmann, Niklas [Verfasser]",2020
[Die Wirtschaft der Gesellschaft] ; L' economia della società / Niklas Luhmann,"Luhmann, Niklas [Verfasser]",2020
Reform und Beratung / Niklas Luhmann ; herausgegeben von Ernst Lukas und Veronika Tacke,"Luhmann, Niklas [Verfasser]; Tacke, Veronika [Herausgeber]; Lukas, Ernst [Herausgeber]",2020
Schriften zur Organisation 4 : Reform und Beratung,"Luhmann, Niklas [Verfasser]; Tacke, Veronika [Herausgeber]; Lukas, Ernst [Herausgeber]",2020
[Soziale Systeme] ; Shakai shisutemu : aru fuhenteki riron no guruntorisu 1 / Luhmann Niklas ; Baba Yasuo,"Luhmann, Niklas. [Verfasser]; Baba, Yasuo. [Sonstige]",2020
[Soziale Systeme] ; Shakai shisutemu : aru fuhenteki riron no guruntorisu 2 / Luhmann Niklas ; Baba Yasuo,"Luhmann, Niklas. [Verfasser]; Baba, Yasuo. [Sonstige]",2020
Sociología del riesgo / Niklas Luhmann,"Luhmann, Niklas [Verfasser]; Nafarrate, Javier Torres [Herausgeber]",2020
Souveränitätsfragmente : Ein Beitrag zur Literaturgeschichte der Souveränität und gegenwärtigen Herausforderungen der Rechtswissenschaften im Spiegel der Digitalisierung / Julien Steinbach,"Steinbach, Julien [Verfasser]",2020
Systemtheorie und Differenzierungstheorie als Kritik : Perspektiven in Anschluss an Niklas Luhmann / Albert Scherr (Hrsg.),"Scherr, Albert [Herausgeber]",2020
Systemtheorie und Differenzierungstheorie als Kritik : Perspektiven in Anschluss an Niklas Luhmann,"Scherr, Albert [Herausgeber]",2020
Aufsätze und Reden / Niklas Luhmann ; herausgegeben von Oliver Jahraus,"Luhmann, Niklas [Verfasser]",2019
[Kontingenz und Recht] ; Contingencia y derecho : la teoría del derecho en un contexto interdisciplinario / Niklas Luhmann,"Luhmann, Niklas [Verfasser]",2019
"[Das Recht in der Gesellschaft] ; Das Recht in der Gesellschaft, chin. / Niklas Luhmann","Luhmann, Niklas",2019
Der Staat und die moderne Gesellschaft / Niklas Luhmann,"Luhmann, Niklas [Mitwirkender]",2019
Diferenciação  functional e modernidade / Niklas Luhmann ; editado por Leopoldo Waizbort,"Luhmann, Niklas [Verfasser]",2019
Einführung in die Systemtheorie : Vorlesung Wintersemester 1991/1992 / Niklas Luhmann,"Luhmann, Niklas [Mitwirkender]",2019
Gesellschaftliche Differenzierung / Niklas Luhmann ; herausgegeben von Ernst Lukas und Veronika Tacke,"Luhmann, Niklas [Verfasser]; Lukas, Ernst [Herausgeber]; Tacke, Veronika [Herausgeber]",2019
Grundrechte als Institution : ein Beitrag zur politischen Soziologie / von Niklas Luhmann,"Luhmann, Niklas [Verfasser]",2019
Grundrechte als Institution. : Ein Beitrag zur politischen Soziologie. / Niklas Luhmann,"Luhmann, Niklas [Verfasser]",2019
Kelsen im Kontext : Beiträge zum Werk Hans Kelsens und geistesverwandter Autoren / Horst Dreier ; herausgegeben von Matthias Jestaedt und Stanley L. Paulson,"Dreier, Horst [Verfasser]; Jestaedt, Matthias [Herausgeber]; Paulson, Stanley L. [Herausgeber]",2019
Kelsen im Kontext : Beiträge zum Werk Hans Kelsens und geistesverwandter Autoren / Horst Dreier,"Dreier, Horst [Verfasser]; Jestaedt, Matthias [Herausgeber]; Paulson, Stanley L. [Herausgeber]",2019
[Luhmann] ; Le droit de la société / Niklas Luhmann,"Luhmann, Niklas [Verfasser]",2019
Niklas Luhmann zur Einführung / Walter Reese-Schäfer,"Reese-Schäfer, Walter [Verfasser]",2019
Niklas Luhmanns systemtheoretische Analysen des Erziehungssystems : Rekonstruktion und pädagogische Kritik / Robert-Josip Mitrović,"Mitrović, Robert-Josip [Verfasser]",2019
Postfundamentale Systemtheorie / Jan Tobias Fuhrmann,"Fuhrmann, Jan Tobias [Verfasser]",2019
Souveränitätsfragmente : ein Beitrag zur Literaturgeschichte der Souveränität und gegenwärtigen Herausforderungen der Rechtswissenschaften im Spiegel der Digitalisierung / Julien Steinbach,"Steinbach, Julien [Verfasser]",2019
Studien zur Theorie und Soziologie des gerichtlichen Verfahrens. : Ein Beitrag zur Diskussion um Grundlagen und Grundbegriffe von Prozeß und Prozeßrecht. / Jürgen Schaper,"Schaper, Jürgen [Verfasser]",2019
Theorie der Gesellschaft : Vorlesung Wintersemester 1992/1993 / Niklas Luhmann,"Luhmann, Niklas [Verfasser]",2019
Theorie organisierter Sozialsysteme / Niklas Luhmann ; herausgegeben von Ernst Lukas und Veronika Tacke,"Luhmann, Niklas [Verfasser]; Lukas, Ernst [Herausgeber]; Tacke, Veronika [Herausgeber]",2019
Verfassung und Positivität des Rechts in der peripheren Moderne. : Eine theoretische Betrachtung und eine Interpretation des Falls Brasilien. / Marcelo Neves,"Neves, Marcelo [Verfasser]",2019
Zur vollständigen operativen Schliessung psychischer und sozialer Systeme / Niklas Luhmann,"Luhmann, Niklas [Verfasser]",2019
Beiträge zur funktionalen Differenzierung der Gesellschaft / Niklas Luhmann,"Luhmann, Niklas [Verfasser]",2018
[Der neue Chef] ; Beol geo sung i im geum nim : sin im bo seu ui sa hoe hag = Der neue Boss / Ni keul la seu Lu man ; Wi leu gen Ka u be pyeon jib ; I Cheol olm gim,"Luhmann, Niklas [Verfasser]",2018
[Die Soziologie und der Mensch] ; Che cos'è la comunicazione? / Niklas Luhmann ; a cura di Alberto Cevolini,"Luhmann, Niklas [Verfasser]",2018
"Die Instabilität politischer Institutionen : Zwei Originalvorträge / Arnold Gehlen, Niklas Luhmann","Gehlen, Arnold [Verfasser]; Luhmann, Niklas [Verfasser]; Gehlen, Arnold [Erzähler]; Luhmann, Niklas [Erzähler]; Sonner, Franz-Maria [Herausgeber]",2018
"Die institutionelle Bestimmtheit sozialer Systeme : Niklas Luhmanns Systemtheorie und die Soziologie der ""Leipziger Schule"" / von Andreas Höntsch","Höntsch, Andreas [Verfasser]",2018
Die institutionelle Bestimmtheit sozialer Systeme. : Niklas Luhmanns Systemtheorie und die Soziologie der »Leipziger Schule«. / Andreas Höntsch,"Höntsch, Andreas [Verfasser]",2018
Die Konstitutionalisierung des Völkerrechts aus systemtheoretischer Sichtweise = Constitutionalization of international law from the perspective of the systems theory / Clemens Mattheis,"Mattheis, Clemens [Verfasser]",2018
Die Konstitutionalisierung des Völkerrechts aus systemtheoretischer Sichtweise,"Mattheis, Clemens [Verfasser]",2018
Die Soziologie und der Mensch / Niklas Luhmann,"Luhmann, Niklas [Verfasser]",2018
Die Wirklichkeit der Organisation / Niklas Luhmann ; herausgegeben von Ernst Lukas und Veronika Tacke,"Luhmann, Niklas [Verfasser]; Tacke, Veronika [Herausgeber]; Lukas, Ernst [Herausgeber]",2018
Estrutura social e semântica / Nilkas Luhmann,"Luhmann, Niklas [Verfasser]",2018
[Luhmann] ; Introduzione alla teoria dei sistemi / Niklas Luhmann ; a cura di Dirk Baecker ; edizione italiana a cura di Stefano Magnolo,"Luhmann, Niklas [Verfasser]",2018
Niklas Luhmann - Beobachtungen der Moderne : mit Vorträgen von Peter Fuchs ...,"Luhmann, Niklas [Mitwirkender]; Fuchs, Peter [Mitwirkender]",2018
Organisationen der Gesellschaft : Gesellschaft und Organisation in der Systemtheorie Niklas Luhmanns,"Drepper, Thomas [Verfasser]",2018
Organisationen der Gesellschaft : Gesellschaft und Organisation in der Systemtheorie Niklas Luhmanns / Thomas Drepper,"Drepper, Thomas [Verfasser]",2018
"[Habermas] ; Sa hoe i lon in ga, sa hoe gong hag in ga? Che gye i lon eun mu eos eul su haeng ha neun ga? = Theorie der Gesellschaft oder Sozialtechnologie? : was leistet Systemforschung? / Wi leu gen Ha beo ma seu, Ni keul la Seu lu man ; I Cheol olm gim","Habermas, Jürgen [Verfasser]; Luhmann, Niklas [Verfasser]",2018
Schriften zur Organisation / Niklas Luhmann ; herausgegeben von Ernst Lukas und Veronika Tacke,"Luhmann, Niklas [Verfasser]; Tacke, Veronika [Herausgeber]; Lukas, Ernst [Herausgeber]",2018
"Soziales System, Gesellschaft, Organisation / Niklas Luhmann","Luhmann, Niklas [Verfasser]",2018
1,Springer Fachmedien Wiesbaden,2018
2,Springer Fachmedien Wiesbaden,2018
5. Konstruktivistische Perspektiven,Springer Fachmedien Wiesbaden,2018
Soziologische Aufklärung 1 bis 6 / Niklas Luhmann,"Luhmann, Niklas [Verfasser]",2018
Teoria dos sistemas na prática / Niklas Luhmann,"Luhmann, Niklas [Verfasser]",2018
"Theorie und Praxis des systemischen Ansatzes : die Systemtheorie Watzlawicks und Luhmanns verständlich erklärt / Joop Willemse, Falko von Ameln","Willemse, Joop [Verfasser]; Ameln, Falko von [Verfasser]",2018
Theorie und Praxis des systemischen Ansatzes : Die Systemtheorie Watzlawicks und Luhmanns verständlich erklärt,"Willemse, Joop [Verfasser]; Ameln, Falko von [Verfasser]",2018
Trust and Power / Niklas Luhmann,"Luhmann, Niklas [Verfasser]; Davis, Howard Übersetzer]; Raffan, John [Übersetzer]; Rooney, Kathryn [Übersetzer]; [King, Michael [Herausgeber]; Morgner, Christian [Herausgeber]",2018
Verfremdungsspiele / Moritz von Stetten,"Stetten, Moritz von [Verfasser]",2018
"""Was ist der Fall?"" und ""Was steckt dahinter?"" : Die zwei Soziologien und die Gesellschaftstheorie / Niklas Luhmann","Luhmann, Niklas [Verfasser]; Blanke, Eberhard [Herausgeber]",2018
"""Was ist der Fall?"" und ""Was steckt dahinter?"" : Die zwei Soziologien und die Gesellschaftstheorie / Niklas Luhmann","Luhmann, Niklas [Verfasser]; Blanke, Eberhard [Herausgeber]",2018
"""Was ist der Fall?""und""Was steckt dahinter?"" : Die zwei Soziologien und die Gesellschaftstheorie / Niklas Luhmann","Luhmann, Niklas; Blanke, Eberhard",2018
[Der neue Chef] ; De nieuwe baas / Niklas Luhmann ; vertaald door Huub Stegeman,"Luhmann, Niklas [Verfasser]; Stegeman, Huub [Übersetzer]",2017
Die Kontrolle von Intransparenz / Niklas Luhmann,"Luhmann, Niklas [Verfasser]; Baecker, Dirk [Herausgeber]",2017
Die Kontrolle von Intransparenz / Niklas Luhmann,"Luhmann, Niklas [Verfasser]; Baecker, Dirk [Herausgeber]",2017
Die Kontrolle von Intransparenz / Niklas Luhmann ; herausgegeben und mit einem Nachwort von Dirk Baecker,"Luhmann, Niklas [Verfasser]; Baecker, Dirk [Herausgeber]",2017
Die Realität der Massenmedien,"Luhmann, Niklas [Verfasser]",2017
Die Realität der Massenmedien / Niklas Luhmann,"Luhmann, Niklas [Verfasser]",2017
[Die Wirtschaft der Gesellschaft] ; La economía de la sociedad / Niklas Luhmann ; traducción e introducción de Aldo Mascareño ; prefacio a la edición española de Dirk Baecker,"Luhmann, Niklas [Verfasser]",2017
[Die Kunst der Gesellschaft] ; L' arte della società / Niklas Luhmann ; edizione italiana a cura di Giancarlo Corsi,"Luhmann, Niklas [Verfasser]",2017
Latours Existenzweisen und Luhmanns Funktionssysteme : Ein soziologischer Theorienvergleich,"Braun, Andreas Christian [Verfasser]",2017
Latours Existenzweisen und Luhmanns Funktionssysteme : ein soziologischer Theorienvergleich / Andreas Christian Braun,"Braun, Andreas Christian [Verfasser]",2017
"Luhmann, intérprete de Husserl : el observador observado / Lionel Lewkow","Lewkow, Lionel [Verfasser]",2017
[Die Realität der Massenmedien] ; Massimeedia reaalsus / Niklas Luhmann ; saksa keelest tõlkinud Mati Sirkel,"Luhmann, Niklas [Verfasser]",2017
Medien und die Koordination des Handelns : Der Begriff des Kommunikationsmediums zwischen Handlungs- und Systemtheorie,"Bachmann, Ulrich [Verfasser]",2017
Medien und die Koordination des Handelns : der Begriff des Kommunikationsmediums zwischen Handlungs- und Systemtheorie / Ulrich Bachmann,"Bachmann, Ulrich [Verfasser]",2017
"Niklas Luhmann / Julian Müller, Ansgar Lorenz","Müller, Julian [Verfasser]; Lorenz, Ansgar [Verfasser]",2017
[Protest] ; Protesta : teoria dei sistemi e movimenti sociali / Niklas Luhmann ; a cura di Kai-Uwe Hellmann ; edizione italiana a cura di Gianluca Bonaiuti ; traduzione dal tedesco di Silvia Rodeschini,"Luhmann, Niklas [Verfasser]",2017
[Ideenevolution] ; Rinen no shinka / Luhmann Niklas ; Hijikata Tōru.,"Luhmann, Niklas. [Verfasser]; Hijikata, Tōru. [Sonstige]",2017
[Liebe] ; Sa lang yeon seub = Liebe : eine Übung / Ni keul la Seu lu man ; An deu le Ki jeol leong pyeo naem ; I Cheol olm gim,"Luhmann, Niklas [Verfasser]",2017
"2 / Baba Yasuo, Akahori Saburō, Sugawara Ken, Takahashi Tooru yaku","Baba, Yasuo [Übersetzer]; Akahori, Saburō [Übersetzer]; Sugawara, Ken, 1964- [Übersetzer]; Takahashi, Tōru, 1970- [Übersetzer]",2017
[Luhmann] ; Shakai no shakai =  Die Gesellschaft der Gesellschaft / Nikurasu Rūman,"Luhmann, Niklas [Verfasser]",2017
[Short cuts] ; Short cuts = Short cuts <albanisch>,"Luhmann, Niklas",2017
"Sinn, Wert und Erfahrung : Internalismus und Externalismus bei Max Weber, Alfred Schütz und Niklas Luhmann / Peter Isenböck","Isenböck, Peter [Verfasser]",2017
"Sinn, Wert und Erfahrung : Internalismus und Externalismus bei Max Weber, Alfred Schütz und Niklas Luhmann / Peter Isenböck","Isenböck, Peter [Verfasser]",2017
Systèmes psychiques et systèmes sociaux,"Sosoe, Lukas K. [Herausgeber]",2017
Systèmes psychiques et systèmes sociaux / Lukas K. Sosoe (éd.),"Sosoe, Lukas K. [Herausgeber]",2017
Systemtheorie : Theorie für die vernetzte Gesellschaft / Christian Schuldt,"Schuldt, Christian [Verfasser]",2017
Systemtheorie : Theorie für die vernetzte Gesellschaft / Christian Schuldt,"Schuldt, Christian [Verfasser]",2017
Systemtheorie der Gesellschaft / Niklas Luhmann,"Luhmann, Niklas [Verfasser]; Kieserling, André [Herausgeber]; Schmidt, Johannes F. K. [Herausgeber]",2017
Systemtheorie der Gesellschaft / Niklas Luhmann,"Luhmann, Niklas [Verfasser]; Kieserling, André [Herausgeber]; Schmidt, Johannes F. K. [Herausgeber]",2017
Systemtheorie der Gesellschaft / Niklas Luhmann ; herausgegeben von Johannes F.K. Schmidt und André Kieserling,"Luhmann, Niklas [Verfasser]; Schmidt, Johannes F. K. [Herausgeber]; Kieserling, André [Herausgeber]",2017
[Luhmann] ; The new boss / Niklas Luhmann ; translated by Peter Gilgen and Michael King,"Luhmann, Niklas [Verfasser]",2017
The New Boss / Niklas Luhmann,"Luhmann, Niklas [Verfasser]",2017
Trust and Power / Niklas Luhmann,"Luhmann, Niklas [Verfasser]; Davis, Howard Übersetzer]; Raffan, John [Übersetzer]; Rooney, Kathryn [Übersetzer]; [King, Michael [Herausgeber]; Morgner, Christian [Herausgeber]",2017
[Liebe] ; Amore : un seminario / Niklas Luhmann ; traduzione di Hellmut Riediger,"Luhmann, Niklas [Verfasser]",2016
Der neue Chef / Niklas Luhmann ; herausgegeben und mit einem Nachwort von Jürgen Kaube,"Luhmann, Niklas [Verfasser]; Kaube, Jürgen [Herausgeber]",2016
Der neue Chef / Niklas Luhmann,"Luhmann, Niklas [Verfasser]; Kaube, Jürgen [Herausgeber]",2016
Die Freiheit der Soziologie : der Grundbegriff der Moderne und die soziologische Theoriebildung / Jurit Kärtner,"Kärtner, Jurit [Verfasser]",2016
"[Soziologische Aufklärung] ; Distinciones directrices / Niklas Luhmann ; presentación de José María García Blanco ; traducción: Pedro Piedras Monroy ; CIS, Centro de Investigaciones Sociológicas","Luhmann, Niklas [Verfasser]",2016
[Luhmann leicht gemacht] ; Lu man yi dian tong : xi tong li lun dao yin = Luhmann leicht gemacht : eine Einführung in die Systemtheorie / Ma ge te Bo ge hao si zhu ; Zhang Jin hui yi,"Berghaus, Margot [Verfasser]; Zhang, Jinhui [Übersetzer]",2016
Luhmanns Schatten : zur Funktion der Philosophie in der medialen Moderne / Claus-Artur Scheier,"Scheier, Claus-Artur [Verfasser]",2016
Luhmanns Schatten : Zur Funktion der Philosophie in der medialen Moderne / Claus-Artur Scheier,"Scheier, Claus-Artur [Verfasser]",2016
Niklas Luhmann / Julian Müller ; Ansgar Lorenz,"Müller, Julian F. [Verfasser]; Lorenz, Ansgar [Illustrator]",2016
[Luhmann] ; O direito da sociedade / Niklas Luhmann ; traduçao Saulo Krieger ; tradução das citações em latim Alexandre Agnolon,"Luhmann, Niklas [Verfasser]",2016
Ohne festen Boden zwischen den Zeilen - oder: Die Philosophie der Wende und die Wende der Philosophie / Hans-Joachim Petsche,"Petsche, Hans-Joachim [Verfasser]",2016
Orientierung im Nihilismus : Luhmann meets Nietzsche / Werner Stegmaier,"Stegmaier, Werner [Verfasser]",2016
[Schriften zu Kunst und Literatur] ; Pisma o sztuce i literaturze / Niklas Luhmann ; pod redakcją Nielsa Werbera ; przełożył Bogdan Baran,"Luhmann, Niklas [Verfasser]; Werber, Niels [Sonstige]; Baran, Bogdan [Übersetzer]",2016
[Luhmann] ; Samfundets samfund / Niklas Luhmann ; på dansk ved Erik Pedersen,"Luhmann, Niklas [Verfasser]",2016
"1 / Baba Yasuo, Uemura Takahiro, Eguchi Atsuhito yaku","Baba, Yasuo [Übersetzer]; Uemura, Takahiro [Übersetzer]; Eguchi, Atsuhito [Übersetzer]",2016
[Luhmann] ; Shakai no hō = Das Recht der Gesellschaft / Nikurasu Rūman,"Luhmann, Niklas [Verfasser]",2016
[Die Religion der Gesellschaft] ; Shakai no shūkyō = Die Religion der Gesellschaft / Nikurasu Rūman ; Hijikata Tōru/Morikawa Takemitsu/Watarai Tomoko/Hatanaka Mariko yaku,"Luhmann, Niklas [Verfasser]; Hijikata, Tōru [Mitwirkender]; Morikawa, Takemitsu [Mitwirkender]; Watarai, Tomoko [Mitwirkender]",2016
"[Luhmann] ; Sistemas sociais : esboço de uma teoria geral / Niklas Luhmann ; tradução Antonio C. Luz Costa, Roberto Dutra Torres Junior, Marco Antonio dos Santos Casanova","Luhmann, Niklas [Verfasser]",2016
[Systemtheorie] ; Teoría de sistemas : una introducción para las ciencias históricas y las humanidades / Frank Becker y Elke Reinhardt-Becker ; traductora Katja Fristsche,"Becker, Frank [Verfasser]; Reinhardt-Becker, Elke [Verfasser]; Fristsche, Katja [Übersetzer]; Chinchilla Perla [Herausgeber]; Lozano Herrera, Rubén [Herausgeber]; Torres Nafarrete, Javier [Herausgeber]",2016
"[Teoria della società] ; Teoria e shoqërisë / Niklas Luhmann, Raffaele De Giorgi","Luhmann, Niklas [Verfasser]; De Giorgi, Raffaele [Verfasser]",2016
Der Kommunikationsbegriff bei Niklas Luhmann und Jürgen Habermas. Ein Theorienvergleich,,2015
Gender Studies und Systemtheorie : Studien zu einem Theorietransfer,"Kampmann, Sabine [Herausgeber]; Karentzos, Alexandra [Herausgeber]; Küpper, Thomas [Herausgeber]",2015
Inklusion/Exklusion : Entwicklungen und Probleme einer systemtheoretischen Unterscheidung / Sina Farzin,"Farzin, Sina [Verfasser]",2015
"Interaktion – Organisation – Gesellschaft revisited : Anwendungen, Erweiterungen, Alternativen / hrsg. von Bettina Heintz und Hartmann Tyrell","Heintz, Bettina [Herausgeber]; Tyrell, Hartmann [Herausgeber]",2015
[Luhmann] ; Iubirea ca pasiune : despre codificarea intimităţii / Niklas Luhmann ; traducere din limba germană: Andrei Anastasescu,"Luhmann, Niklas [Verfasser]; Anastasescu, Andrei [Übersetzer]",2015
Le droit - un système social : un commentaire coopératif de Niklas Luhmann = Law as a social system / Lukas K. Sosoe (éd.),"Sosoe, Lukas K. [Herausgeber]",2015
[Die Religion der Gesellschaft] ; Náboz̆enství spolec̆nosti / Niklas Luhmann ; translation Tomáš Chudý ; Univerzita Karlova v Praze,"Luhmann, Niklas [Verfasser]",2015
Politische Soziologie / Niklas Luhmann,"Luhmann, Niklas [Verfasser]; Kieserling, André [Herausgeber]",2015
Politische Soziologie / Niklas Luhmann. Hrsg. von André Kieserling,"Luhmann, Niklas [Verfasser]; Kieserling, André [Herausgeber]",2015
"Rechtsnormen und Rationalität : zum Problem der Rechtsgeltung bei Hans Kelsen, Jürgen Habermas und Niklas Luhmann / von Johannes Meiners","Meiners, Johannes [Verfasser]",2015
"Rechtsnormen und Rationalität. : Zum Problem der Rechtsgeltung bei Hans Kelsen, Jürgen Habermas und Niklas Luhmann. / Johannes Meiners","Meiners, Johannes [Verfasser]",2015
Sa hoe i lon ib mun = Einführung in die Theorie der Gesellschaft / Ni keul la seu Lu man ; Di leu keu Be keo pyeon jib ; I Cheol olm gim,"Luhmann, Niklas [Verfasser]",2015
"[Das Erziehungssystem der Gesellschaft] ; Sa hoe ui gyo yug che gye = Das Erziehungssystem der Gesellschaft / Ni keul La seu lu man ; Di teo Len chen pyeon jib ; I Cheol, Bag Yeo seong olm gim","Luhmann, Niklas [Verfasser]",2015
